{
  "artifact_family": "verifier_decision",
  "schema_version": "1.0.0",
  "policy_version": "phase1-gate-v1",
  "ruleset_version": "verifier-core-v1",
  "runner_contract_version": "software-change-runner-v2",
  "trace_id": "tr_phase1_first_bounded_loop",
  "run_id": "run_phase1_first_bounded_loop",
  "step_id": "step_create_bounded_artifact",
  "source_runner_digest": "sha256:2395edd134049a388b54416a16165ea792197f13cff01c6fcf1b8706c98bf6ae",
  "decision": "allow",
  "reasons": [],
  "findings": [],
  "required_evidence_persistence": true
}
